{
  "$schema": "./schemas/contract-index.schema.json",
  "proposal_id": "kumwe.dart-sdk.contract-index",
  "proposal_version": "0.1.0-proposal.1",
  "status": "proposal",
  "authoritative": false,
  "audited_core": {
    "repository": "kumwe/cms",
    "commit": "4e5083b3fe43790605ae5c6c5bf8e392f9822efc",
    "observed_at": "2026-08-15"
  },
  "profiles": [
    {
      "id": "business_companion",
      "title": "Generated business companion",
      "description": "Native discovery, query, CRUD, relations, history, actions, reports, exports and declarative extension navigation.",
      "required_requirements": [
        "CORE-API-001",
        "CORE-API-002",
        "CORE-AUTH-001",
        "CORE-CTX-001",
        "CORE-MUTATION-001",
        "CORE-BUSINESS-001",
        "CORE-REPORT-001",
        "CORE-DOCUMENT-001",
        "CORE-BULK-001",
        "CORE-SURFACE-001",
        "CORE-LOCALIZATION-001"
      ]
    },
    {
      "id": "cms_management",
      "title": "CMS management",
      "description": "Content, models, workflows, navigation, settings, media, identities, extensions and automation through complete machine contracts.",
      "required_requirements": [
        "CORE-API-001",
        "CORE-API-002",
        "CORE-AUTH-001",
        "CORE-CTX-001",
        "CORE-MUTATION-001",
        "CORE-COLLECTION-001",
        "CORE-MEDIA-001",
        "CORE-EXTENSION-001"
      ]
    },
    {
      "id": "administrator_parity",
      "title": "Administrator parity",
      "description": "Equivalent authorized administrator outcomes, including security, sessions, step-up, localization and KIS presentation surfaces.",
      "required_requirements": [
        "CORE-API-001",
        "CORE-API-002",
        "CORE-AUTH-001",
        "CORE-CTX-001",
        "CORE-MUTATION-001",
        "CORE-BUSINESS-001",
        "CORE-REPORT-001",
        "CORE-DOCUMENT-001",
        "CORE-BULK-001",
        "CORE-COLLECTION-001",
        "CORE-SURFACE-001",
        "CORE-LOCALIZATION-001",
        "CORE-MEDIA-001",
        "CORE-SECURITY-001",
        "CORE-SESSION-001",
        "CORE-APPROVAL-001",
        "CORE-KIS-001",
        "CORE-EXTENSION-001"
      ]
    },
    {
      "id": "portal_parity",
      "title": "Portal parity",
      "description": "Equivalent authenticated portal account, context, generated business and approval outcomes.",
      "required_requirements": [
        "CORE-API-001",
        "CORE-API-002",
        "CORE-AUTH-001",
        "CORE-CTX-001",
        "CORE-MUTATION-001",
        "CORE-BUSINESS-001",
        "CORE-REPORT-001",
        "CORE-DOCUMENT-001",
        "CORE-SURFACE-001",
        "CORE-LOCALIZATION-001",
        "CORE-SESSION-001",
        "CORE-APPROVAL-001"
      ]
    },
    {
      "id": "public_site_parity",
      "title": "Public site parity",
      "description": "Anonymous native pages, navigation, media and declared theme semantics without interpreting server Twig.",
      "required_requirements": [
        "CORE-API-001",
        "CORE-API-002",
        "CORE-LOCALIZATION-001",
        "CORE-PUBLIC-001"
      ]
    },
    {
      "id": "realtime_updates",
      "title": "Realtime update hints",
      "description": "Authenticated notifications that prompt reconciliation through a durable policy-filtered change feed.",
      "required_requirements": [
        "CORE-API-001",
        "CORE-API-002",
        "CORE-AUTH-001",
        "CORE-CTX-001",
        "CORE-EVENTS-001",
        "CORE-REALTIME-001"
      ]
    },
    {
      "id": "offline_sync",
      "title": "Offline synchronization",
      "description": "Durable policy-aware delta pull, mutation push, acknowledgement, conflict, attachment and document-numbering behavior.",
      "required_requirements": [
        "CORE-API-001",
        "CORE-API-002",
        "CORE-AUTH-001",
        "CORE-CTX-001",
        "CORE-MUTATION-001",
        "CORE-DOCUMENT-001",
        "CORE-EVENTS-001",
        "CORE-SYNC-001"
      ]
    }
  ],
  "requirements": [
    {
      "id": "CORE-API-001",
      "capability_id": "kumwe.core.openapi.complete",
      "title": "Complete invariant OpenAPI",
      "priority": "P0",
      "state": "partial",
      "contract_plane": "invariant",
      "required_for": ["business_companion", "cms_management", "administrator_parity", "portal_parity", "public_site_parity", "realtime_updates", "offline_sync"],
      "summary": "Publish complete request, success, documented failure, header, security and compatibility schemas for every operation admitted to an SDK profile.",
      "core_evidence": [
        "kumwe/cms@4e5083b3fe43790605ae5c6c5bf8e392f9822efc:api/openapi/kumwe-v1.json",
        "kumwe/cms@4e5083b3fe43790605ae5c6c5bf8e392f9822efc:docs/roadmap/README.md#P0-C"
      ],
      "adoption": "core_change_required"
    },
    {
      "id": "CORE-API-002",
      "capability_id": "kumwe.core.problem-details.stable",
      "title": "Stable Problem Details registry",
      "priority": "P0",
      "state": "missing",
      "contract_plane": "invariant",
      "required_for": ["business_companion", "cms_management", "administrator_parity", "portal_parity", "public_site_parity", "realtime_updates", "offline_sync"],
      "summary": "Expose finite actionable problem codes and typed extensions; human detail text must not be the client control-flow contract.",
      "core_evidence": [
        "kumwe/cms@4e5083b3fe43790605ae5c6c5bf8e392f9822efc:api/openapi/kumwe-v1.json",
        "kumwe/cms@4e5083b3fe43790605ae5c6c5bf8e392f9822efc:docs/roadmap/README.md#P0-C"
      ],
      "adoption": "core_change_required",
      "depends_on": ["CORE-API-001"]
    },
    {
      "id": "CORE-AUTH-001",
      "capability_id": "kumwe.core.auth.native",
      "title": "Native application user authorization",
      "priority": "P0",
      "state": "missing",
      "contract_plane": "invariant",
      "required_for": ["business_companion", "cms_management", "administrator_parity", "portal_parity", "realtime_updates", "offline_sync"],
      "summary": "Adopt a reviewed external-user-agent PKCE, device, or equivalent native application authorization flow with refresh, revocation and logout semantics.",
      "core_evidence": [
        "kumwe/cms@4e5083b3fe43790605ae5c6c5bf8e392f9822efc:docs/rest-api.md#Authentication",
        "kumwe/cms@4e5083b3fe43790605ae5c6c5bf8e392f9822efc:api/openapi/kumwe-v1.json"
      ],
      "adoption": "core_decision_required"
    },
    {
      "id": "CORE-CTX-001",
      "capability_id": "kumwe.core.context.discovery",
      "title": "Authority and context discovery",
      "priority": "P0",
      "state": "partial",
      "contract_plane": "invariant",
      "required_for": ["business_companion", "cms_management", "administrator_parity", "portal_parity", "realtime_updates", "offline_sync"],
      "summary": "Expose subject, site, selectable organization/workspace and generation bindings required for explicit requests and safe cache invalidation.",
      "core_evidence": [
        "kumwe/cms@4e5083b3fe43790605ae5c6c5bf8e392f9822efc:docs/rest-api.md#Authentication"
      ],
      "adoption": "core_change_required",
      "depends_on": ["CORE-AUTH-001"]
    },
    {
      "id": "CORE-MUTATION-001",
      "capability_id": "kumwe.core.mutation.contract",
      "title": "Consistent idempotency and concurrency",
      "priority": "P0",
      "state": "partial",
      "contract_plane": "invariant",
      "required_for": ["business_companion", "cms_management", "administrator_parity", "portal_parity", "offline_sync"],
      "summary": "Declare per-operation replay, late-duplicate, retry, status and optimistic-concurrency semantics without conflicting shared descriptions.",
      "core_evidence": [
        "kumwe/cms@4e5083b3fe43790605ae5c6c5bf8e392f9822efc:docs/rest-api.md#Retry",
        "kumwe/cms@4e5083b3fe43790605ae5c6c5bf8e392f9822efc:src/BusinessRecord/Domain/BusinessRecordReplayWindow.php",
        "kumwe/cms@4e5083b3fe43790605ae5c6c5bf8e392f9822efc:src/BusinessSurface/Application/CustomBusinessActionExecutor.php"
      ],
      "adoption": "core_change_required",
      "depends_on": ["CORE-API-002"]
    },
    {
      "id": "CORE-BUSINESS-001",
      "capability_id": "kumwe.core.business.generated",
      "title": "Generated business data plane",
      "priority": "P0",
      "state": "observed",
      "contract_plane": "runtime",
      "required_for": ["business_companion", "administrator_parity", "portal_parity"],
      "summary": "Policy-filtered definition discovery, bounded query, CRUD, relations, history, actions, approval requests and operation status are present through fixed generic routes.",
      "core_evidence": [
        "kumwe/cms@4e5083b3fe43790605ae5c6c5bf8e392f9822efc:docs/architecture/generated-business-surfaces.md",
        "kumwe/cms@4e5083b3fe43790605ae5c6c5bf8e392f9822efc:src/BusinessSurface/Application/BusinessSurfaceCatalog.php"
      ],
      "adoption": "not_required",
      "depends_on": ["CORE-API-001", "CORE-MUTATION-001"]
    },
    {
      "id": "CORE-REPORT-001",
      "capability_id": "kumwe.core.business.reporting",
      "title": "Generated reports and exports",
      "priority": "P0",
      "state": "observed",
      "contract_plane": "runtime",
      "required_for": ["business_companion", "administrator_parity", "portal_parity"],
      "summary": "Policy-aware report discovery/execution and bounded asynchronous export status/download resources are present.",
      "core_evidence": [
        "kumwe/cms@4e5083b3fe43790605ae5c6c5bf8e392f9822efc:docs/business-integrations.md",
        "kumwe/cms@4e5083b3fe43790605ae5c6c5bf8e392f9822efc:docs/rest-api.md#Generated"
      ],
      "adoption": "not_required",
      "depends_on": ["CORE-API-001"]
    },
    {
      "id": "CORE-SURFACE-001",
      "capability_id": "kumwe.core.client-surface.discovery",
      "title": "Declarative client-surface discovery",
      "priority": "P0",
      "state": "proposed",